{
  "$schema": "./graph.schema.json",
  "schemaVersion": "1.0.0",
  "status": "verified",
  "sources": [
    {
      "id": "cv-automobile",
      "kind": "cv",
      "fileName": "cv_Rida_Faradi_automobile.pdf",
      "sha256": "3d6bd00fd53134139bb55ca1bdd2b24148794869f854a8d448f46bd96f41d896"
    },
    {
      "id": "cv-pfe",
      "kind": "cv",
      "fileName": "CV_Rida_Faradi_PFE.pdf",
      "sha256": "edd20065f48cf4844af18039511890cff5dc2fe2e71f04abebc5eec540a7909d"
    },
    {
      "id": "cv-maroc",
      "kind": "cv",
      "fileName": "CV_Rida_Faradi_maroc_format.pdf",
      "sha256": "c5cfeb4963fee6db9ad4dcc2e9ad157b104e93c2fd840e650d2b4f42300fa2bb"
    }
  ],
  "identity": {
    "brand": "ME/SIGNAL",
    "referenceUrl": "https://portfolio1.moad-elabbassi.workers.dev",
    "source": "user-brief"
  },
  "profile": {
    "personNodeId": "person-core",
    "name": "Rida Faradi",
    "headline": "Electrical & embedded engineering student",
    "summary": "Automotive ADAS experience at UTAC Maroc. CAN/LIN analysis, embedded control and electrical diagnostics. Seeking a PFE internship in automotive embedded systems in 2027.",
    "cvDownloadUrl": "/cv-rida-faradi.pdf"
  },
  "clusters": [
    {
      "id": "automotive",
      "name": "Automotive & validation",
      "color": "#c7f578",
      "sourceNodeIds": [
        "experience-utac",
        "project-ags",
        "skill-testing",
        "skill-adas",
        "skill-can",
        "skill-lin",
        "skill-documentation",
        "tech-canalyzer"
      ]
    },
    {
      "id": "electrical",
      "name": "Electrical & power",
      "color": "#75b3b3",
      "sourceNodeIds": [
        "experience-ocp",
        "project-safetybrain",
        "skill-pid",
        "skill-fault-detection",
        "skill-battery-soh",
        "tech-matlab",
        "tech-labview",
        "tech-proteus"
      ]
    },
    {
      "id": "embedded",
      "name": "Embedded & electronics",
      "color": "#a6c7ad",
      "sourceNodeIds": [
        "education-ensa",
        "project-factory",
        "skill-acquisition",
        "tech-arduino",
        "tech-esp32",
        "tech-raspberry-pi",
        "tech-stm32",
        "tech-pic",
        "tech-uart",
        "tech-i2c",
        "tech-ads1115",
        "tech-vhdl-fpga",
        "tech-arduino-ide"
      ]
    },
    {
      "id": "software",
      "name": "Software & data",
      "color": "#83b7a7",
      "sourceNodeIds": [
        "project-bms",
        "tech-c-cpp",
        "tech-python",
        "tech-json",
        "tech-http",
        "tech-rest",
        "tech-fastapi",
        "tech-websocket",
        "tech-xgboost",
        "tech-streamlit"
      ]
    }
  ],
  "nodes": [
    {
      "id": "person-core",
      "type": "Person",
      "name": "Rida Faradi",
      "status": "verified",
      "clusterId": null,
      "sourceRefs": [
        {
          "sourceId": "cv-automobile",
          "locator": "Page 1 / Header",
          "evidence": "RIDA FARADI; +212 649 781 159; faradirida1@gmail.com; LinkedIn"
        },
        {
          "sourceId": "cv-automobile",
          "locator": "Page 1 / Profil",
          "evidence": "Élève-ingénieur en génie électrique et systèmes embarqués à l’ENSA Khouribga, à la recherche d’un stage PFE en 2027 dans le secteur automobile."
        },
        {
          "sourceId": "cv-automobile",
          "locator": "Page 1 / Expérience professionnelle / UTAC Maroc",
          "evidence": "Participé à la préparation d’essais automobiles et à l’évaluation des fonctions ADAS BSD, RVC et DMS. Visualisé et analysé les communications CAN/LIN avec CANalyzer. Structuré les analyses et résultats d’essais dans une documentation technique standardisée."
        }
      ],
      "details": {
        "summary": "Electrical and embedded engineering student at ENSA Khouribga, with automotive testing experience at UTAC Maroc. Seeking a PFE internship in automotive embedded systems in 2027.",
        "organization": "ENSA Khouribga",
        "dateLabel": "Seeking PFE internship · 2027",
        "role": "Engineering student; degree in progress",
        "visualization": "none"
      }
    },
    {
      "id": "experience-utac",
      "type": "Experience",
      "name": "UTAC Maroc",
      "status": "verified",
      "clusterId": "automotive",
      "sourceRefs": [
        {
          "sourceId": "cv-automobile",
          "locator": "Page 1 / Expérience professionnelle / UTAC Maroc",
          "evidence": "UTAC Maroc — Stage PFA, systèmes embarqués et fonctions ADAS. Juillet–août 2026 | Oued Zem, Maroc."
        },
        {
          "sourceId": "cv-automobile",
          "locator": "Page 1 / Expérience professionnelle / UTAC Maroc",
          "evidence": "Participé à la préparation d’essais automobiles et à l’évaluation des fonctions ADAS BSD, RVC et DMS. Visualisé et analysé les communications CAN/LIN avec CANalyzer. Structuré les analyses et résultats d’essais dans une documentation technique standardisée."
        }
      ],
      "details": {
        "summary": "PFA internship in embedded systems and ADAS functions in Oued Zem, Morocco.",
        "organization": "UTAC Maroc",
        "dateLabel": "July–August 2026",
        "problem": null,
        "role": "Contributed to automotive test preparation and evaluation of BSD, RVC and DMS functions; visualized and analyzed CAN/LIN communications with CANalyzer.",
        "outcome": "Structured test analyses and results in standardized technical documentation.",
        "stackNodeIds": [
          "skill-testing",
          "skill-adas",
          "skill-can",
          "skill-lin",
          "tech-canalyzer",
          "skill-documentation"
        ],
        "visualization": "can-frames"
      }
    },
    {
      "id": "experience-ocp",
      "type": "Experience",
      "name": "OCP Group",
      "status": "verified",
      "clusterId": "electrical",
      "sourceRefs": [
        {
          "sourceId": "cv-maroc",
          "locator": "Page 1 / Expérience professionnelle / OCP Group",
          "evidence": "Stage d’initiation - Systèmes électriques et réseaux industriels | Juillet - août 2025. OCP Group - Site industriel de Khouribga. Découvert l’environnement industriel haute tension : organisation et fonctionnement d’un poste électrique HT/MT. Étudié le schéma unifilaire du poste."
        }
      ],
      "details": {
        "summary": "Introductory internship in electrical systems and industrial networks at the Khouribga industrial site.",
        "organization": "OCP Group",
        "dateLabel": "July–August 2025",
        "problem": null,
        "role": "Observed the organization and operation of an HV/MV electrical substation and studied its single-line diagram.",
        "outcome": null,
        "visualization": "waveform"
      }
    },
    {
      "id": "education-ensa",
      "type": "Education",
      "name": "ENSA Khouribga",
      "status": "verified",
      "clusterId": "embedded",
      "sourceRefs": [
        {
          "sourceId": "cv-automobile",
          "locator": "Page 1 / Formation",
          "evidence": "Diplôme d’ingénieur d’État en génie électrique — systèmes embarqués. 2022–en cours. École Nationale des Sciences Appliquées de Khouribga (ENSA Khouribga), Maroc."
        }
      ],
      "details": {
        "summary": "State engineering degree in electrical engineering, specializing in embedded systems. Degree in progress.",
        "organization": "École Nationale des Sciences Appliquées de Khouribga",
        "dateLabel": "2022–present",
        "role": "Engineering student",
        "visualization": "none"
      }
    },
    {
      "id": "project-ags",
      "type": "Project",
      "name": "Calandre active (AGS)",
      "status": "verified",
      "clusterId": "automotive",
      "sourceRefs": [
        {
          "sourceId": "cv-automobile",
          "locator": "Page 1 / Projets pertinents / Calandre active (AGS)",
          "evidence": "Arduino, ESP32, PID, UART, HTTP. Développé une régulation PID pour piloter les volets selon la température et la vitesse; relié les contrôleurs par UART/JSON et contribué à la supervision Web en temps réel."
        }
      ],
      "details": {
        "summary": "Automotive mechatronic control for active grille shutters.",
        "dateLabel": null,
        "problem": "Control grille shutters according to temperature and speed.",
        "role": "Developed PID control, linked Arduino and ESP32 controllers through UART/JSON, and contributed to real-time web supervision.",
        "outcome": null,
        "stackNodeIds": [
          "tech-arduino",
          "tech-esp32",
          "skill-pid",
          "tech-uart",
          "tech-json",
          "tech-http"
        ],
        "visualization": "sensor-stream"
      }
    },
    {
      "id": "project-bms",
      "type": "Project",
      "name": "BMS · Battery SOH prediction",
      "status": "verified",
      "clusterId": "software",
      "sourceRefs": [
        {
          "sourceId": "cv-automobile",
          "locator": "Page 1 / Projets pertinents / BMS",
          "evidence": "BMS — prédiction du SOH de batteries lithium-ion. Python, XGBoost, Streamlit. Développé un modèle XGBoost de prédiction du SOH et une interface Streamlit pour visualiser les résultats."
        }
      ],
      "details": {
        "summary": "Prediction of lithium-ion battery state of health with XGBoost and an interactive Streamlit interface.",
        "dateLabel": null,
        "problem": "Predict and visualize the state of health of lithium-ion batteries.",
        "role": "Developed the XGBoost prediction model and Streamlit results interface.",
        "outcome": null,
        "stackNodeIds": [
          "tech-python",
          "tech-xgboost",
          "tech-streamlit",
          "skill-battery-soh"
        ],
        "visualization": "power-curve"
      }
    },
    {
      "id": "project-safetybrain",
      "type": "Project",